{
  "built_images": {
    "rocm-primus-qwen25-7b": {
      "model": "primus_pyt_megatron_lm_train_qwen2.5-7b",
      "docker_image": "rocm/primus:v26.1",
      "dockerfile": "docker/primus_megatron_train.ubuntu.amd.Dockerfile",
      "base_docker": "rocm/primus:v26.1",
      "build_duration": 0,
      "local_image": true,
      "registry_image": null,
      "registry": null,
      "gpu_vendor": "AMD"
    }
  },
  "built_models": {
    "rocm-primus-qwen25-7b": {
      "name": "primus_pyt_megatron_lm_train_qwen2.5-7b",
      "url": "",
      "dockerfile": "docker/primus_megatron_train",
      "scripts": "scripts/primus/megatron-lm/run.sh",
      "n_gpus": "-1",
      "owner": "mad.support@amd.com",
      "training_precision": "",
      "multiple_results": "perf_primus-megatron-Qwen2.5-7B.csv",
      "tags": [
        "pyt",
        "pretrain",
        "qwen2.5-7b",
        "training"
      ],
      "timeout": -1,
      "args": "--model_repo primus_pyt_megatron_lm_train_qwen2.5-7b",
      "additional_docker_run_options": "--privileged --group-add render --shm-size 64G --device=/dev/infiniband --cap-add IPC_LOCK --ulimit memlock=-1 -v /sys:/sys:ro -v /run/udev:/run/udev:ro"
    }
  },
  "context": {
    "docker_env_vars": {
      "MAD_SECRETS_HFTOKEN": "${MAD_SECRETS_HFTOKEN}",
      "NCCL_DEBUG": "INFO",
      "NCCL_DEBUG_SUBSYS": "INIT,NET",
      "NCCL_IB_DISABLE": "0",
      "NCCL_NET": "IB",
      "NCCL_IB_HCA": "mlx5_0:1,mlx5_1:1",
      "NCCL_IB_GID_INDEX": "3",
      "NCCL_SOCKET_IFNAME": "eth0",
      "GLOO_SOCKET_IFNAME": "eth0",
      "LIBIBVERBS_DRIVER_PATH": "/usr/lib/x86_64-linux-gnu/libibverbs",
      "RDMAV_DRIVERS": "mlx5",
      "IBV_DRIVERS": "mlx5",
      "LD_LIBRARY_PATH": "/usr/lib/x86_64-linux-gnu:/usr/local/lib",
      "IBV_SHOW_WARNINGS": "1"
    },
    "docker_mounts": {
      "/dev/infiniband": "/dev/infiniband"
    },
    "docker_build_arg": {},
    "gpu_vendor": "AMD",
    "guest_os": "UBUNTU",
    "docker_gpus": "0,1,2,3,4,5,6,7"
  },
  "credentials_required": [],
  "summary": {
    "successful_builds": [],
    "failed_builds": [],
    "total_build_time": 0,
    "successful_pushes": [],
    "failed_pushes": []
  },
  "deployment_config": {
    "target": "slurm",
    "slurm": {
      "partition": "amd-rccl",
      "account": "amd-rccl",
      "qos": "normal",
      "exclude": "useocpm2m-097-089,useocpm2m-097-094",
      "nodes": 2,
      "gpus_per_node": 8,
      "time": "12:00:00",
      "output_dir": "./slurm_output",
      "exclusive": true,
      "network_interface": "eth0"
    },
    "distributed": {
      "launcher": "torchrun",
      "backend": "nccl",
      "port": 29500,
      "nnodes": 2,
      "nproc_per_node": 8
    },
    "env_vars": {
      "HF_HOME": "/mnt/m2m_nobackup/data/cache/huggingface",
      "TORCH_HOME": "/mnt/m2m_nobackup/data/cache/torch",
      "XDG_CACHE_HOME": "/mnt/m2m_nobackup/data/cache/xdg",
      "PIP_CACHE_DIR": "/mnt/m2m_nobackup/data/cache/pip",
      "MAD_DATAHOME": "/mnt/m2m_nobackup/data/models",
      "NCCL_DEBUG": "INFO",
      "NCCL_DEBUG_SUBSYS": "INIT,NET",
      "NCCL_IB_DISABLE": "0",
      "NCCL_NET": "IB",
      "NCCL_SOCKET_IFNAME": "eth0",
      "GLOO_SOCKET_IFNAME": "eth0",
      "NCCL_IB_GID_INDEX": "3",
      "NCCL_IB_HCA": "mlx5_0:1,mlx5_1:1",
      "NCCL_TIMEOUT": "900",
      "TORCH_NCCL_ASYNC_ERROR_HANDLING": "1",
      "TORCH_NCCL_HIGH_PRIORITY": "1",
      "OMP_NUM_THREADS": "8",
      "MIOPEN_FIND_MODE": "1",
      "MIOPEN_USER_DB_PATH": "/mnt/m2m_nobackup/data/cache/miopen"
    },
    "debug": false,
    "docker_gpus": "0,1,2,3,4,5,6,7"
  }
}
