{
  "built_images": {
    "rocm-pyt-vllm-dissag-llama31-8b": {
      "model": "pyt_vllm_dissag_llama-3.1-8b",
      "docker_image": "rocm/vllm:rocm7.0.0_vllm_0.11.2_20251210-disagg-rdmafix",
      "dockerfile": "docker/vllm_disagg_inference.ubuntu.amd.Dockerfile",
      "base_docker": "rocm/vllm:rocm7.0.0_vllm_0.11.2_20251210-disagg-rdmafix",
      "build_duration": 0,
      "local_image": true,
      "registry_image": null,
      "registry": null,
      "gpu_vendor": "AMD"
    }
  },
  "built_models": {
    "rocm-pyt-vllm-dissag-llama31-8b": {
      "name": "pyt_vllm_dissag_llama-3.1-8b",
      "url": "",
      "dockerfile": "docker/vllm_disagg_inference",
      "scripts": "scripts/vllm_dissag/run.sh",
      "data": "huggingface",
      "n_gpus": "-1",
      "owner": "mad.support@amd.com",
      "training_precision": "",
      "multiple_results": "perf-vllm-disagg-Llama-3.1-8B-Instruct.csv",
      "tags": [
        "pyt",
        "vllm",
        "disagg",
        "inference"
      ],
      "timeout": -1,
      "args": "--model_repo /shared_inference/models_blog/Llama-3.1-8B-Instruct",
      "additional_docker_run_options": "--privileged --group-add render --shm-size 64G --device=/dev/infiniband --cap-add IPC_LOCK --ulimit memlock=-1 -v /sys:/sys:ro -v /sys/class/infiniband:/sys/class/infiniband:ro -v /run/udev:/run/udev:ro -v /etc/libibverbs.d:/etc/libibverbs.d:ro -v /usr/lib/x86_64-linux-gnu:/usr/lib/x86_64-linux-gnu:ro"
    }
  },
  "context": {
    "docker_env_vars": {
      "MAD_SECRETS_HFTOKEN": "${MAD_SECRETS_HFTOKEN}",
      "NCCL_DEBUG": "INFO",
      "NCCL_DEBUG_SUBSYS": "INIT,NET",
      "NCCL_IB_DISABLE": "0",
      "NCCL_NET": "IB",
      "NCCL_IB_HCA": "mlx5_0:1,mlx5_1:1",
      "NCCL_IB_GID_INDEX": "3",
      "NCCL_SOCKET_IFNAME": "eth0",
      "GLOO_SOCKET_IFNAME": "eth0",
      "UCX_NET_DEVICES": "mlx5_0:1",
      "UCX_TLS": "rc,sm,self,rocm_copy,rocm_ipc,tcp",
      "UCX_SOCKADDR_TLS_PRIORITY": "rdmacm,tcp",
      "UCX_SOCKADDR_CM_ENABLE": "y",
      "UCX_RDMA_CM_ENABLED": "y",
      "RDMAV_DRIVERS": "mlx5",
      "IBV_DRIVERS": "mlx5",
      "LIBIBVERBS_DRIVER_PATH": "/usr/lib/x86_64-linux-gnu/libibverbs",
      "LD_LIBRARY_PATH": "/usr/lib/x86_64-linux-gnu:/usr/local/lib:/opt/rocm/lib",
      "IBV_SHOW_WARNINGS": "1",
      "MODEL_NAME": "Llama-3.1-8B-Instruct",
      "xP": "1",
      "yD": "1",
      "PROXY_TYPE": "vllm_router",
      "ROUTER_PORT": "2584",
      "BENCHMARK_PORT": "2584",
      "MODEL_DIR": "/shared_inference/<USER>/data/models_blog",
      "PD_SYNC_ROOT": "/shared_inference/<USER>/data/vllm_sync",
      "OUTPUT_DIR": "/myworkspace/run_directory/workdir"
    },
    "docker_mounts": {
      "/dev/infiniband": "/dev/infiniband",
      "/sys/class/infiniband": "/sys/class/infiniband",
      "/shared_inference": "/shared_inference",
      "/mnt/m2m_nobackup": "/mnt/m2m_nobackup"
    },
    "docker_build_arg": {},
    "gpu_vendor": "AMD",
    "guest_os": "UBUNTU",
    "docker_gpus": "0,1,2,3,4,5,6,7"
  },
  "credentials_required": [],
  "summary": {
    "successful_builds": [],
    "failed_builds": [],
    "total_build_time": 0,
    "successful_pushes": [],
    "failed_pushes": []
  },
  "deployment_config": {
    "target": "slurm",
    "slurm": {
      "partition": "amd-rccl",
      "account": "amd-rccl",
      "qos": "normal",
      "exclude": "useocpm2m-097-089,useocpm2m-097-094,useocpm2m-097-021,useocpm2m-097-008",
      "nodes": 3,
      "gpus_per_node": 8,
      "time": "12:00:00",
      "output_dir": "./slurm_output",
      "exclusive": true,
      "network_interface": "eth0"
    },
    "distributed": {
      "launcher": "vllm",
      "backend": "nccl",
      "port": 29500,
      "nnodes": 3,
      "nproc_per_node": 1
    },
    "env_vars": {
      "NCCL_DEBUG": "INFO",
      "NCCL_DEBUG_SUBSYS": "INIT,NET",
      "NCCL_IB_DISABLE": "0",
      "NCCL_NET": "IB",
      "NCCL_SOCKET_IFNAME": "eth0",
      "GLOO_SOCKET_IFNAME": "eth0",
      "NCCL_IB_GID_INDEX": "3",
      "NCCL_IB_HCA": "mlx5_0:1,mlx5_1:1",
      "NCCL_TIMEOUT": "900",
      "OMP_NUM_THREADS": "8",
      "MODEL_NAME": "Llama-3.1-8B-Instruct",
      "xP": "1",
      "yD": "1",
      "PD_SYNC_ROOT": "/shared_inference/<USER>/data/vllm_sync",
      "PROXY_TYPE": "vllm_router",
      "ROUTER_PORT": "2584",
      "BENCHMARK_PORT": "2584",
      "OUTPUT_DIR": "/myworkspace/run_directory/workdir"
    },
    "debug": false,
    "docker_gpus": "0,1,2,3,4,5,6,7",
    "gpus_per_node": 8
  }
}
